id;user_name;email;name;address_1;address_2;address_3;address_4;address_5;date_added;date_inactive;user_picture;user_picture_content_type
1;Savings Account syndicate Planner;Alyce_Stokes@yahoo.com;Centers;Factors;South Dakota envisioneer Music;Nakfa;Bahamian Dollar Investment Account;Games Regional Digitized;2019-06-05T20:55:23;2019-06-05T18:41:42;4d61796f747465;image/png
2;Industrial;Opal.Kirlin89@hotmail.com;Credit Card Account National Awesome;Aruba;software scale interactive;Louisiana Specialist Home Loan Account;Plastic;Car Industrial deliverables;2019-06-06T03:20:47;2019-06-06T08:03:16;6d6167656e7461206d6f6e69746f72203130383070;image/png
3;Unbranded Plastic Tuna Frozen;Rossie.Mueller@hotmail.com;Fantastic Plastic Chicken;payment;withdrawal COM;embrace Developer;synthesize Idaho compress;Sleek Metal Table Small;2019-06-06T02:16:46;2019-06-06T10:14:03;486172626f72204d6f6e74616e61;image/png
4;Corporate Phased relationships;Columbus.Farrell59@hotmail.com;Chilean Peso Unidades de fomento;Web virtual deposit;Squares mint green e-business;Ghana back-end National;Direct;Profit-focused;2019-06-06T02:34:23;2019-06-06T12:48:40;737570706c792d636861696e73206d6167656e7461;image/png
5;encompassing;Twila21@gmail.com;Oklahoma facilitate;Engineer;Exclusive Moroccan Dirham card;zero tolerance;mission-critical;Berkshire Small Plastic Pants Investor;2019-06-06T07:04:27;2019-06-05T20:29:12;44657369676e65722050657273697374656e74;image/png
6;Handmade 24/7 Re-contextualized;Fredy_Koss@hotmail.com;deliver bypassing;hacking installation magenta;HDD;Algerian Dinar;firewall;Future-proofed deposit Sausages;2019-06-05T20:14:28;2019-06-06T03:16:55;627269636b732d616e642d636c69636b7320436f6e637265746520476c6f62616c;image/png
7;Fiji Dollar Profound Bacon;Kaylah.Larkin@hotmail.com;Executive;Customer Human deposit;even-keeled Saint Helena Pound;Internal AI optical;bypassing Marketing;Dynamic Home Loan Account Tools;2019-06-06T10:23:17;2019-06-05T14:15:38;4c6174766961;image/png
8;Ports Manager Fish;Dave17@gmail.com;world-class program alarm;Nevada;Berkshire;dedicated Persevering;Coordinator Cambridgeshire Investor;cross-platform Borders;2019-06-05T22:58:41;2019-06-05T20:46:10;6c6f63616c2053686f6573;image/png
9;Intelligent Frozen Sausages Villages;Tavares_Tillman@gmail.com;Factors;architectures;Wisconsin Facilitator Incredible;reinvent;eco-centric Bedfordshire mesh;Configuration UIC-Franc;2019-06-05T23:08:32;2019-06-06T11:08:01;4469726563746f7220436f6e637265746520426564666f72647368697265;image/png
10;portal calculating Metal;Floy29@hotmail.com;schemas Synergistic Personal Loan Account;Avon;Auto Loan Account olive;Yen;Unbranded Fresh Pants Tools California;North Dakota Garden;2019-06-06T01:38:57;2019-06-06T09:06:09;436f6d70757465727320536d616c6c20467265736820476c6f766573206261636b2d656e64;image/png
